Kabarto 2,36.79299,42.85833,Duhok,Sumail,Camp,Yes,No,IQ0803-0003,20-Aug,Yes,Govt.-MoI/JCCC,Yes,Yes,ACTED,6,1,Yes,6,4,,,Yes,Face to face at complaints desk Complaints boxes,Camp Management Committee Distribution Committee Maintenance Committee WASH Committee Health Committee,Yes,Functional sports facilities (e.g. football pitch) Community centre or space for community self-run activities Community centre run by humanitarian organizations (currently open) Community centre run by humanitarian organizations (currently closed due to COVID-19) Child Friendly Space (currently open) Child Friendly Space (currently closed due to COVID-19),Excel based,Camp Management Team Facebook Community leaders,3000,96,0,MoMD Type of Tents,3000,3000,0,3000,0,,,,,,,,,,,,,,,,,,,,,,,,,,,,,Yes,8,2611,13226,538,558,576,580,1023,1115,968,940,1768,2011,1258,1291,264,336,No,Yes,Electricity grid Centralized generators,54,Network (communal access),Yes,5,No,Yes,Communal garbage bin,Private latrines,3000,4,Private showers,3000,4,All (100%),None,All (100%),No other issue reported,Yes,6,Increased opening hours,Yes,Yes,Yes,Yes,Yes,No,Between 2- 5 km,Yes,No,Yes,Yes,NA,Once per month,Once per month,No,,,No,No,No,Individual counselling Group counselling (with small amount of people) PSS through case management,"The same services are functioning as before COVID-19, but some or all services are now being delivered remotely (e.g. by phone)",200,15,"Yes, currently open and operational for IDPs",Yes,,Yes,,3750,NA,No,0,Yes,,Reduced availability of items Increased prices Reduced access to a previously accessible market,"Harikar IOM VOP, PDO, Rawanga Foundation, SOS, War Child UK, Hrikar, IRCS, NRC, SOSD, VOP",SOSD VOP,SOSD War Child,Sosd,,BRHA,BRHA,BRHA,SWEDO UNHCR,HARIKAR UNICEF HEEVIE,,Harikar Heevie,UNICEF,WFP,,PLC
Shariya,36.79687,42.96181,Duhok,Sumail,Camp,Yes,No,IQ0803-0006,20-Aug,Yes,Govt.-MoI/JCCC,Yes,Yes,ACTED,6,5,Yes,10,1,,,Yes,Face to face with CCCM staff / Community Mobilisers Through community representatives (e.g. Sector/Block leaders),Camp Management Committee Youth committee,Yes,Functional sports facilities (e.g. football pitch) Community centre run by humanitarian organizations (currently closed due to COVID-19) Child Friendly Space (currently closed due to COVID-19),Excel based,Camp Management Team Word of Mouth Community leaders,4000,100,30,AFAD  Type Tents,,,,,,,,,,,4000,3750,0,1000,1000,,,,,,,,,,,,,,,,,,,Yes,4,2947,15663,313,406,535,576,1337,1344,1244,1139,2159,2480,1720,1730,264,416,No,Yes,Electricity grid Generators privately owned,70,Network (communal access),Yes,0,Yes,Yes,Municipal collection,Public latrines,800,20,Public showers,768,20,About a quarter (~ 25%),All (100%),Less than a quarter,"Skin diseases (scabies, contagious rashes, etc.) Numerous trauma-related injuries",Yes,6,Increased opening hours,Yes,Yes,Yes,Yes,Yes,No,Between 2- 5 km,Yes,Yes,Yes,Yes,0-25%,Less than once a month,Once per month,No,,,No,No,Yes,Structured PSS,"The same services are functioning as before COVID-19, but some or all services are now being delivered remotely (e.g. by phone)",300,15,Currently closed due to COVID-19 but usually functioning for IDPs,Yes,,Yes,,2500,Yes,Yes,750,Yes,,Reduced availability of items,"Harikar IOM, Buhara Hivya, Emma. Lafam, SOS, Hrikar, Dorcas, ILC, IOM, SOSD, VOP",SOSD Spring of Hope Mission Enfance,SOSD Spring of Hope Mission Enfance,Spring of Hope Mission Enfance SOSD,,PWJ,PWJ,PWJ,PWJ MoDM,HARIKAR UNICEF HEEVIE,,IOM Harikar Heevie,MoDM,BCF MoDM,,IOM
Al Karamah,34.691389,43.618333,Salah al-Din,Tikrit,Camp,Yes,No,IQ1808-0014-002,20-Aug,Yes,Govt.-MoI/JCCC,Yes,Yes,BLUMONT,5,5,Yes,2,3,4,1,Yes,Hotline phone number Complaints boxes Face to face with CCCM staff / Community Mobilisers Through community representatives (e.g. Sector/Block leaders),Camp Management Committee Women committee Youth committee Distribution Committee Maintenance Committee WASH Committee Health Committee Education Committee,Yes,Community centre or space for community self-run activities Community centre run by humanitarian organizations (currently open) Child Friendly Space (currently closed due to COVID-19),Excel based,Camp Management Team Word of Mouth Community leaders,683,0,0,MoMD Type of Tents,1546,393,100,55,75,,,,,,,,,,,,,,,,,,,,,,,,,,,,,No,2,177,726,6,3,52,49,83,90,79,85,28,38,109,84,8,12,Yes,No,Electricity grid,20,Network (communal access),Yes,0,No,Yes,Municipal collection,Communal latrines,176,4,Communal showers,84,9,About three quarters (~75%),All (100%),About three quarters (~75%),"Skin diseases (scabies, contagious rashes, etc.) Numerous cases of fever",Yes,5,Opening hours and services have not changed Reduced services,Yes,No,Yes,No,Yes,No,More than 5 km,Yes,Yes,Yes,Yes,26%-50%,Once per month,Less than once a month,Yes,"Needing to obtain security clearance/coupons Needing to provide a specific reason for movement (employment, medical, school)",Restrictions have increased since COVID-19 and are imposed solely for health reasons,No,No,No,Psychological First Aid PSS through case management,"The same services are functioning as before COVID-19, and all services are being delivered in-person",553,7,"Yes, currently open and operational for IDPs",Yes,,No,Within 2 km,240,Yes,No,0,Yes,,No changes,Intersos IRC Tajdid,BROB Intersos,BROB Intersos,,,SSDF,SSDF,Mercy Corps,Mercy Hands,UIMS DAMA UNICEF,,,,WFP,,
Yahyawa,35.327263,44.49611,Kirkuk,Kirkuk,Camp,Yes,No,IQ1302-0002,20-Aug,Yes,IDP self-management,Yes,Yes,BLUMONT,6,5,Yes,8,0,4,1,Yes,Complaints boxes Through community representatives (e.g. Sector/Block leaders),Camp Management Committee Women committee Youth committee Distribution Committee Other Committee,Yes,Child Friendly Space (currently open),Excel based,Camp Management Team Loudspeakers Camp Committees,NA,0,0,"UNHCR Type ofTents AFAD  Type Tents Caravans Constructed Structure (ex. Housing units constructed by blocks, fully upgraded)",,,,,,107,107,107,0,0,49,49,NA,NA,0,,,,,,36,36,0,0,,,,,199,199,0,,,No,0,349,1906,90,80,98,110,205,230,209,206,155,146,186,119,26,46,No,No,Electricity grid,125,Dug Well (HH Well),Yes,0,No,Yes,Communal garbage bin,Private latrines,420,212,Public showers Private showers,417,318,About three quarters (~75%),About half (~50%),About half (~50%),Other(s) – specify,Yes,6,Decreased opening hours,No,Yes,Yes,No,Yes,No,More than 5 km,Yes,Yes,Yes,Yes,0-25%,Once per month,Once per month,No,,,No,Yes,Yes,No PSS services,There were no services in this camp before COVID-19,1,3,NA,Yes,,Yes,,800,Yes,No,NA,Yes,,Reduced availability of items Increased prices Reduced access to a previously accessible market,HAI,SCI,SCI,,,Mercy Corps,Mercy Corps,Mercy Corps,MoDM Mercy Corps,IOM,,,,WFP,Iraqi Alamal Association,
Chamishku,37.178,42.668,Duhok,Zakho,Camp,Yes,No,IQ0804-0003,20-Aug,Yes,Govt.-MoI/JCCC,Yes,Yes,ACTED,5,5,Yes,10,3,,,Yes,Face to face at complaints desk Complaints boxes,Camp Management Committee,Yes,Community centre run by humanitarian organizations (currently open) Community centre run by humanitarian organizations (currently closed due to COVID-19) Child Friendly Space (currently open) Child Friendly Space (currently closed due to COVID-19),Excel based,Camp Management Team Community leaders,5000,104,122,MoMD Type of Tents,5000,5000,0,0,2000,,,,,,,,,,,,,,,,,,,,,,,,,,,,,No,2,4740,24621,623,586,772,893,1864,1919,1676,1749,3622,3821,2892,2956,506,742,No,No,Electricity grid Centralized generators,65,Dug Well (HH Well),Yes,0,Yes,Yes,Municipal collection,Public latrines,5000,5,Public showers,5000,5,All (100%),All (100%),All (100%),Other(s) – specify,Yes,6,Increased opening hours,Yes,Yes,Yes,Yes,Yes,No,Between 2- 5 km,Yes,Yes,Yes,Yes,76%-100%,Once per month,Once per month,No,,,No,No,Yes,Psychological First Aid,"The same services are functioning as before COVID-19, but some or all services are now being delivered remotely (e.g. by phone)",0,2,Currently closed due to COVID-19 but usually functioning for IDPs,Yes,,Yes,,NA,Yes,No,0,Yes,,No changes,"Harikar Seed SOSD SWEDO Dorcas FWE MoDM War Child Yahad, Yahad, Dorcas, Harikar, Seed Foundation, Swedo, VOP, SoSD",BRHA Harikar Seed SOSD Dorcas,Yahad War Child FEW,,UNHCR Harikar,BRHA Harikar,Harikar,Harikar,UNHCR,HARIKAR MoDM UNICEF,,Harikar MoDM Seed  Yahad,MoDM,WFP,,
Dawadia,37.093332,43.229453,Duhok,Al-Amadiya,Camp,Yes,No,IQ0801-0001,20-Aug,Yes,Govt.-MoI/JCCC,Yes,Yes,ACTED,6,6,Yes,4,2,,,Yes,Hotline phone number Face to face with CCCM staff / Community Mobilisers Through community representatives (e.g. Sector/Block leaders),Camp Management Committee Women committee Youth committee Maintenance Committee WASH Committee Health Committee,Yes,Community centre run by humanitarian organizations (currently closed due to COVID-19) Child Friendly Space (currently closed due to COVID-19),Excel based,Camp Management Team Word of Mouth Community leaders,900,4,0,Caravans,,,,,,,,,,,,,,,,,,,,,900,839,61,300,,,,,,,,,,No,1,579,2972,74,76,108,93,235,292,237,246,386,452,316,316,52,89,No,No,Electricity grid,95,Dug Well (HH Well),Yes,0,No,Yes,Municipal collection,Private latrines,900,3,Private showers,NA,NA,All (100%),None,All (100%),Numerous cases of pregnancy related diseases Numerous trauma-related injuries No other issue reported,Yes,5,Opening hours and services have not changed,Yes,Yes,Yes,Yes,Yes,No,Between 2- 5 km,Yes,Yes,Yes,Yes,NA,Once per month,Once per month,No,,,No,No,Yes,Structured PSS Individual counselling Learning spaces and recreational PSS activities PSS through case management,"The same services are functioning as before COVID-19, but some or all services are now being delivered remotely (e.g. by phone)",95,25,"Yes, currently open and operational for IDPs",Yes,,Yes,,1010,No,No,0,Yes,,No changes,"Emma Harikar, Emma, Harikar, IRCS, IOM, Rusaz, VOP",VOP,VOP,,,LWF,LWF,LWF,WFP,Step-In HARIKAR UNICEF,,,,MODM,,
AAF,33.145167,43.850436,Al-Anbar,Al-Falluja,Camp,Yes,Yes,IQ0102-0019,20-Aug,Yes,Govt.- Anbar Emergency Cell,Yes,Yes,IOM,7,5,Yes,8,0,4,1,Yes,Face to face at complaints desk Face to face with CCCM staff / Community Mobilisers,Maintenance Committee Youth committee Women committee,No,Functional sports facilities (e.g. football pitch) Community centre run by humanitarian organizations (currently open) Child Friendly Space (currently closed due to COVID-19),Excel based,Camp Management Team Word of Mouth Camp Committees,5400,0,0,"MoMD Type of Tents UNHCR Type ofTents RHU (Refugee Housing Unit) Caravans Constructed Structure (ex. Housing units constructed by blocks, fully upgraded)",866,1193,0,1193,1000,2,2,0,2,2,,,,,,,,,,,463,463,200,200,63,63,NA,63,16,16,16,,,No,5,931,3850,102,105,203,211,304,316,406,421,436,694,187,298,57,110,No,No,Electricity grid,60,RO.UNIT STATION ,Yes,0,Yes,No,Municipal collection,Private latrines Communal latrines,100,39,Communal showers Private showers,100,39,About a quarter (~ 25%),About half (~50%),Less than a quarter,No other issue reported,Yes,7,Opening hours and services have not changed,No,No,No,Yes,Yes,No,More than 5 km,Yes,Yes,Yes,Yes,51%-75%,Less than once a month,Less than once a month,Yes,"Needing to obtain security clearance/coupons Time restrictions on when to leave and return Needing to provide a specific reason for movement (employment, medical, school)",Restrictions have increased since COVID-19 and are imposed for other reasons than just health,No,No,No,Psychological First Aid,"The same services are functioning as before COVID-19, but some or all services are now being delivered remotely (e.g. by phone)",10,50,"Yes, currently open and operational for IDPs",Yes,,Yes,,700,No,No,0,Yes,,Reduced availability of items Increased prices,"UNHCR, DRC, IRC",SSORD IRC UNHCR UIMS,SSORD,UNICEF,,SSORD,SSORD,Mercy Corps,IOM UNHCR Mercy Hands,UIMS DARY IOM IMC,,,,WFP,,
Khazer M1,36.30807,43.54371,Ninewa,Al-Hamdaniya,Camp,Yes,No,IQ1503-0010,20-Aug,Yes,Govt.-MoI/JCCC,Yes,No,,5,0,Yes,13,2,,,Yes,Hotline phone number Complaints boxes,Camp Management Committee,Yes,Child Friendly Space (currently closed due to COVID-19),ASSIST,Camp Management Team Word of Mouth Camp Committees,NA,0,0,MoMD Type of Tents,1700,1513,NA,NA,387,,,,,,,,,,,,,,,,,,,,,,,,,,,,,No,4,1076,5684,112,108,282,291,713,644,652,605,397,484,550,683,51,112,No,No,Centralized generators,70,Water Trucking,Yes,0,No,Yes,Communal garbage bin,Communal latrines,300,19,Communal showers,300,19,None,Less than a quarter,Less than a quarter,Numerous cases of respiratory diseases,Yes,7,Opening hours and services have not changed,No,No,No,Yes,Yes,No,Between 2- 5 km,Yes,Yes,Yes,Yes,51%-75%,Once per month,Once per month,No,,,No,No,No,PSS through case management,All services that were delivered before COVID-19 are now stopped,200,20,Usually not functioning for IDPs,Yes,,Yes,,1417,No,No,0,Yes,,No changes,SWEDO,Al-Masala,PAO,,,PAH,PAH,PAH,UNHCR,IMC BCF ZHIAN ORG DoH,,,,WFP MoDM,,
Hasansham U2,36.30727,43.53602,Ninewa,Al-Hamdaniya,Camp,Yes,No,IQ1503-0024,20-Aug,Yes,Govt.-MoI/JCCC,Yes,No,,5,5,Yes,14,2,,,Yes,Complaints boxes Through community representatives (e.g. Sector/Block leaders),Camp Management Committee,Yes,Community centre run by humanitarian organizations (currently closed due to COVID-19) Child Friendly Space (currently closed due to COVID-19),ASSIST,Camp Management Team Community leaders,1562,0,0,UNHCR Type ofTents,,,,,,1233,1233,822,411,34,,,,,,,,,,,,,,,,,,,,,,,,No,3,933,4230,70,84,265,230,545,594,393,421,300,221,479,539,21,68,No,No,Centralized generators,70,Water Trucking,Yes,0,No,Yes,Communal garbage bin,Communal latrines,393,11,Communal showers,393,11,All (100%),About half (~50%),About three quarters (~75%),"Skin diseases (scabies, contagious rashes, etc.)",Yes,7,Opening hours and services have not changed,No,No,No,Yes,Yes,No,More than 5 km,NA,NA,NA,NA,NA,Once per month,Once per month,No,,,No,No,No,Learning spaces and recreational PSS activities,"The same services are functioning as before COVID-19, and all services are being delivered in-person",400,30,"Yes, currently open and operational for IDPs",Yes,,No,Between 2-5 km,890,Yes,No,0,Yes,,No changes,SWEDO,Al-Masala TDH-Lausanne,TDH-Lausanne,,UNHCR,PAH,PAH,PAH,WFP,HEEVIE VIYAN DoH,,Viyan,UNICEF DoH,,,
Qoratu,34.544193,45.390722,Diyala,Khanaqin,Camp,Yes,Yes,IQ1004-0011,20-Aug,Yes,Govt.-MoI/JCCC,Yes,No,,5,0,Yes,3,0,2,0,Yes,Complaints boxes,Camp Management Committee,No,Community centre or space for community self-run activities Child Friendly Space (currently closed due to COVID-19),ASSIST,Loudspeakers,NA,,17,UNHCR Type ofTents,,,,,,185,170,170,0,0,,,,,,,,,,,,,,,,,,,,,,,,No,0,138,662,25,30,31,30,57,59,56,59,77,83,66,72,8,9,Yes,No,Electricity grid,60,Dug Well (HH Well),Yes,0,No,Yes,Municipal collection,Private latrines,NA,NA,Private showers,NA,NA,All (100%),All (100%),All (100%),No other issue reported,No,5,PHC has closed since the start of COVID-19,No,No,No,No,Yes,No,More than 5 km,NA,NA,NA,NA,0-25%,Once per month,Once per month,No,,,No,No,Yes,Learning spaces and recreational PSS activities,"The same services are functioning as before COVID-19, and all services are being delivered in-person",0,50,"Yes, currently open and operational for IDPs",Yes,,Yes,,NA,Yes,No,0,Yes,,No changes,HAI,SWEDO-PDO Mobile team,DOLSA,,,Arche Nova,,Arche Nova,UNHCR,ZHIAN ORG UNICEF,,,,WFP MoDM,,
Tazade,34.70576,45.44898,Al-Sulaymaniyah,Kalar,Camp,Yes,No,IQ0505-0002,20-Aug,Yes,Govt.-MoI/JCCC,Yes,No,,5,5,Yes,4,0,,,Yes,Hotline phone number Complaints boxes,No Committees,No,Child Friendly Space (currently open),Excel based,Camp Management Team Loudspeakers,NA,,28,Caravans,,,,,,,,,,,,,,,,,,,,,900,350,0,0,,,,,,,,,,No,0,230,1120,35,39,54,72,98,102,98,139,109,120,141,85,10,18,Yes,Yes,Electricity grid Centralized generators,NA,Network (private access),Yes,0,No,Yes,Municipal collection,Private latrines,NA,NA,Private showers,NA,NA,None,None,None,Other(s) – specify,No,5,PHC has closed since the start of COVID-19,No,No,No,No,Yes,No,NA,NA,NA,NA,NA,NA,Once per month,Once per month,No,,,No,No,NA,No PSS services,NA,0,NA,NA,Yes,,Yes,,NA,NA,No,0,Yes,,No changes,HAI,SWEDO-PDO Mobile team,DOLSA (Garmyan),,,Arche Nova,,Arche Nova,UNHCR,ZHIAN ORG UNICEF,,,,,,
