Berseve 2,37.17934,42.86215,Duhok,Zakho,Camp,Yes,No,IQ0804-0002,20-Aug,Yes,Govt.-MoI/JCCC,Yes,Yes,ACTED,5,5,Yes,5,1,,,No,,Camp Management Committee,No,Community centre run by humanitarian organizations (currently open) Community centre run by humanitarian organizations (currently closed due to COVID-19) Child Friendly Space (currently closed due to COVID-19),Excel based,Camp Management Team,NA,NA,0,"Constructed Structure (ex. Housing units constructed by blocks, fully upgraded)",,,,,,,,,,,,,,,,,,,,,,,,,,,,,0,,0,,,No,4,1538,7623,290,328,302,324,597,676,619,620,1016,754,1050,784,117,146,Yes,Yes,Electricity grid Generators privately owned,75,Network (private access),Yes,0,No,Yes,Communal garbage bin,Private latrines,911,8,Private showers,911,8,All (100%),Don’t know / Unsure,Don’t know / Unsure,Numerous cases of diarrhoea Numerous cases of fever Physical disabilities,Yes,7,Increased opening hours,Yes,NA,NA,Yes,Yes,No,More than 5 km,Yes,Yes,Yes,Yes,NA,More than once per month,More than once per month,No,,,No,No,Yes,Structured PSS,NA,100,15,Yes,Yes,,Yes,,2643,,No,0,Yes,,,"Government / Local Authorities, Harikar, Shingal Organization for Social Development,  Swedo",Government / Local Authorities,Government / Local Authorities,MoE,Unknown,Unknown,Government / Local Authorities,,World Vision,UNICEF HARIKAR DAMA MEDAIR,,,,,,
Debaga 1,35.882912,43.808181,Erbil,Makhmour,Camp,Yes,No,IQ1107-0007,20-Aug,Yes,Govt.-MoI/JCCC,Yes,Yes,BCF,5,0,Yes,5,15,0,0,Yes,Complaints boxes Face to face with CCCM staff / Community Mobilisers,Camp Management Committee Distribution Committee,Yes,Community centre or space for community self-run activities,Access Database based,Camp Management Team Facebook Community leaders,NA,0,0,"Constructed Structure (ex. Housing units constructed by blocks, fully upgraded)",,,,,,,,,,,,,,,,,,,,,,,,,,,,,0,1553,180,,,No,2,1449,7727,186,210,366,343,859,842,662,641,830,910,768,859,73,178,Yes,No,Electricity grid Centralized generators Generators privately owned,100,Network (communal access),Yes,0,No,Yes,Rubbish pit,Private latrines,1800,4,Communal showers Private showers,1800,4,All (100%),All (100%),None,"Numerous cases of diarrhoea Skin diseases (scabies, contagious rashes, etc.) Numerous cases of pregnancy related diseases",Yes,5,Opening hours and services have not changed,No,No,No,Yes,Yes,No,NA,Yes,Yes,Yes,Yes,NA,Once per month,Once per month,Yes,Time restrictions on when to leave and return provide covide test during return,Restrictions have increased since COVID-19 and are imposed solely for health reasons,No,No,No,Psychological First Aid Individual counselling PSS through case management,"The same services are functioning as before COVID-19, and all services are being delivered in-person",50,35,Usually not functioning for IDPs,Yes,,Yes,,NA,No,No,0,Yes,,No changes,SWEDO,Al-Masala,TDH-Italy,Government/Local Authorities,Mercy Corps,Mercy Corps,Mercy Corps-Alqadar,Mercy Corps-Alqadar,UNHCR,IOM Heevie Zhian Org DoH Jiyan Foundation,HEEVIE,Heevie,,WFP MoDM,,TDH
HTC,33.241974,43.576869,Al-Anbar,Al-Falluja,Camp,Yes,Yes,IQ0102-0001,20-Aug,Yes,Govt.- Anbar Emergency Cell,Yes,Yes,DRC,7,5,Yes,19,0,2,1,Yes,Face to face at complaints desk Hotline phone number Complaints boxes Face to face with CCCM staff / Community Mobilisers,Camp Management Committee Women committee,No,Functional sports facilities (e.g. football pitch) Community centre run by humanitarian organizations (currently closed due to COVID-19) Child Friendly Space (currently closed due to COVID-19),Excel based,Camp Management Team,575,0,0,UNHCR Type ofTents RHU (Refugee Housing Unit),,,,,,348,348,NA,NA,130,,,,,,,,,,,,,,,383,383,50,23,,,,,,No,4,526,2598,77,83,155,160,207,199,286,303,442,588,,,42,56,Yes,No,Electricity grid,150,Network (private access),Yes,0,No,Yes,Communal garbage bin,Communal latrines Private latrines,357,7,Communal showers Private showers,263,10,About three quarters (~75%),About half (~50%),About three quarters (~75%),Numerous cases of fever Numerous cases of respiratory diseases,Yes,6,Opening hours and services have not changed,No,Yes,Yes,No,Yes,No,More than 5 km,Yes,No,Yes,No,0-25%,Once per month,Once per month,Yes,"Needing to obtain security clearance/coupons Needing to show ID documents to civilian authorities or security actors to exit/enter the camp Time restrictions on when to leave and return Needing to provide a specific reason for movement (employment, medical, school)",Restrictions have increased since COVID-19 and are imposed for other reasons than just health,No,No,No,Psychological First Aid Structured PSS PSS through case management,"The same services are functioning as before COVID-19, but some or all services are now being delivered remotely (e.g. by phone)",30,35,Currently closed due to COVID-19 but usually functioning for IDPs,Yes,,No,Within 2 km,747,No,No,0,Yes,,No changes,"UNHCR, DRC, IRC",Afkar,DRC SSORD UNICEF,,,SSORD,Mercy Corps SSORD,Mercy Corps,UNHCR Mercy Hands,DARY UIMS,,PUI,,WFP,,
Qayyarah-Jad'ah 5,35.76501,43.25513,Ninewa,Al-Mosul,Camp,Yes,No,IQ1505-0010-004,20-Aug,Yes,RNVDO,Yes,No,,6,0,Yes,9,0,,,Yes,Complaints boxes Face to face with CCCM staff / Community Mobilisers Through community representatives (e.g. Sector/Block leaders),Women committee Youth committee Maintenance Committee Health Committee Education Committee Sector leader,Yes,Community centre or space for community self-run activities Child Friendly Space (currently open),Excel based,Camp Management Team Camp Committees Sector Representatives,7425,0,0,MoMD Type of Tents,5311,5245,5245,0,0,,,,,,,,,,,,,,,,,,,,,,,,,,,,,Yes,30,4057,16016,735,729,1010,987,1390,1403,1593,1585,1360,1903,1118,1702,155,346,No,Yes,Electricity grid,70,Water Trucking,Yes,0,No,Yes,Communal garbage bin,Public latrines,1392,12,Public showers Communal showers,1607,10,All (100%),All (100%),All (100%),No other issue reported,Yes,7,Opening hours and services have not changed,Yes,Yes,Yes,Yes,Yes,No,Between 2- 5 km,Yes,Yes,Yes,Yes,0-25%,Once per month,Once per month,No,,,No,No,Yes,Structured PSS Individual counselling Learning spaces and recreational PSS activities PSS through case management,"Some services are functioning as before COVID-19, but some are stopped",300,3,Usually not functioning for IDPs,Yes,,No,Between 2-5 km,1700,No,Yes,307,Yes,,No changes,"IMC Intersos WRO, NP","TDH-Italy WRO, INTERSOS","TDH-Italy WRO, INTERSOS",Intersos,RNVDO,Pekawa UNICEF,Pekawa UNICEF,Pekawa UNICEF,MOMD/ UNICEF,DARY IMC ZHIAN ORG HI,,DARY IMC,DARY,WFP MoDM,RNVDO,
Khanke,36.77905,42.77649,Duhok,Sumail,Camp,Yes,No,IQ0803-0005,20-Aug,Yes,Govt.-MoI/JCCC,Yes,Yes,ACTED,5,0,Yes,12,2,,,Yes,Hotline phone number Complaints boxes,Camp Management Committee Distribution Committee Maintenance Committee WASH Committee Health Committee Education Committee,No,Community centre run by humanitarian organizations (currently open) Community centre run by humanitarian organizations (currently closed due to COVID-19) Child Friendly Space (currently open) Child Friendly Space (currently closed due to COVID-19),Excel based,Camp Management Team,NA,0,0,UNHCR Type ofTents,,,,,,3120,3120,NA,NA,400,,,,,,,,,,,,,,,,,,,,,,,,No,0,2709,14407,406,395,506,514,1184,1186,1103,1061,2075,2083,1600,1623,271,400,No,No,Electricity grid Generators privately owned,75,Network (private access),Yes,0,No,Yes,Municipal collection,Communal latrines,1561,9,Communal showers,NA,NA,All (100%),None,All (100%),"Numerous cases of diarrhoea Skin diseases (scabies, contagious rashes, etc.) Numerous cases of respiratory diseases Numerous trauma-related injuries No other issue reported",Yes,6,Increased opening hours,Yes,Yes,Yes,Yes,Yes,No,Between 2- 5 km,Yes,Yes,Yes,Yes,0-25%,Once per month,Once per month,No,,,No,No,No,Psychological First Aid,All services that were delivered before COVID-19 are now stopped,25,10,"Yes, currently open and operational for IDPs",Yes,,Yes,,5000,No,No,NA,Yes,,Reduced availability of items,"SP VOP AMMAR FOUNDATION JIYAN FOUNDATION FYF  PDO UNFPA, PDO, VoP, SoS, Harikar, NRC",SOSD FYF,SP VOP FYF,FYF,,KURDS,KURDS,KURDS,,HARIKAR UNICEF JIYAN FOUNDATION,,Jiyan Foundation Amar Foundation UNFPA FYF,,,,
Baharka,36.294349,43.992,Erbil,Erbil,Camp,Yes,No,IQ1102-0001,20-Aug,Yes,Govt.-MoI/JCCC,Yes,Yes,BCF,5,1,Yes,8,8,0,0,Yes,Face to face at complaints desk,Camp Management Committee,Yes,Community centre or space for community self-run activities,Access Database based,Camp Management Team,950,0,50,UNHCR Type ofTents,,,,,,580,580,0,0,0,,,,,,,,,,,,,,,,,,,,,,,,No,2,871,4367,96,90,270,291,501,515,440,422,301,332,570,406,46,87,Yes,No,Electricity grid Generators privately owned,100,Dug Well (HH Well),Yes,0,No,Yes,Municipal collection,Private latrines,1184,4,Private showers,1184,4,None,None,None,"Skin diseases (scabies, contagious rashes, etc.) Numerous cases of fever Numerous cases of respiratory diseases",Yes,5,Increased opening hours Opening hours and services have not changed,No,Yes,Yes,Yes,Yes,No,More than 5 km,Yes,Yes,Yes,Yes,0-25%,Once per month,Once per month,No,,,No,No,No,Structured PSS Individual counselling,"The same services are functioning as before COVID-19, and all services are being delivered in-person",0,6,"Yes, currently open and operational for IDPs",Yes,,Yes,,1188,No,No,0,Yes,,No changes,SWEDO,Al-Masala,"PAO\
TDH Italy ",Al-Mortaqa,UNHCR,Mercy Corps,Mercy Corps,Qadar,UNHCR,ZHIAN ORG BCF DoH,,,,WFP MoDM,,BCF
Muskar Saad Camp,33.75105448,44.66377843,Diyala,Baquba,Camp,Yes,Yes,IQ1002-0007,20-Aug,Yes,Govt.-Diyala Governorate Office,No,Yes,UNHCR,2,2,No,2,0,,,Yes,Face to face at complaints desk SMS/WhatsApp/Viber number Complaints boxes Face to face with CCCM staff / Community Mobilisers,Camp Management Committee Distribution Committee Maintenance Committee WASH Committee,No,Community centre run by humanitarian organizations (currently closed due to COVID-19) Child Friendly Space (currently closed due to COVID-19),ASSIST,Camp Management Team Printed material (banners/posters/pamphlets) Word of Mouth Local Authorities Community leaders Mobile Phones Camp Committees,159,0,0,Caravans,,,,,,,,,,,,,,,,,,,,,NA,159,106,32,,,,,,,,,,No,1,102,500,20,36,25,29,33,44,42,46,50,31,34,92,8,10,Yes,No,Electricity grid,20,Network (private access),Yes,0,Yes,No,Municipal collection,Private latrines,160,3,Private showers,160,3,None,All (100%),About a quarter (~ 25%),"Skin diseases (scabies, contagious rashes, etc.) Numerous cases of fever Physical disabilities Mental disabilities",Yes,5,Decreased opening hours Reduced services PHC has closed since the start of COVID-19,Yes,Yes,No,Yes,Yes,No,Between 2- 5 km,NA,NA,NA,NA,76%-100%,More than once per month,More than once per month,No,,,No,No,No,Psychological First Aid Structured PSS Individual counselling Group counselling (with small amount of people) Learning spaces and recreational PSS activities,All services that were delivered before COVID-19 are now stopped,0,3,"Yes, currently open and operational for IDPs",Yes,,No,Between 2-5 km,NA,Yes,No,0,Yes,,Reduced availability of items Increased prices Reduced access to a previously accessible market No access to a previously accessible market,DRC UNHCR LCN,UNFPA UNHCR,UNFPA UNHCR,,,,,,Government / Local Authorities MOMD UNHCR,,,,,,,
Essian,36.72461,43.26904,Ninewa,Al-Shikhan,Camp,Yes,No,IQ1506-0001,20-Aug,Yes,Govt.-MoI/JCCC,Yes,Yes,ACTED,6,6,Yes,8,1,,,No,,Camp Management Committee,No,Community centre run by humanitarian organizations (currently closed due to COVID-19),Excel based,Camp Management Team NGO Facebook Mobile Phones,NA,150,0,MoMD Type of Tents,3003,3000,0,0,200,,,,,,,,,,,,,,,,,,,,,,,,,,,,,No,3,2680,14269,385,433,665,620,915,980,615,691,2013,1154,2618,2381,342,457,No,No,Electricity grid Centralized generators,30,Network (private access),Yes,0,No,Yes,Communal garbage bin,Private latrines,3000,5,Private showers,3000,5,About three quarters (~75%),About three quarters (~75%),About three quarters (~75%),Numerous trauma-related injuries,Yes,7,Decreased opening hours,No,Yes,No,Yes,Yes,No,Between 2- 5 km,Yes,Yes,Yes,Yes,0-25%,Once per month,Once per month,No,,,No,No,No,Psychological First Aid,NA,0,NA,NA,Yes,,Yes,,NA,No,No,0,No,None that the household can access (non-COVID-19 movement restrictions/security),Reduced availability of items,,WAR CHILD,,UNICEF SWEDO Caritas-Czech,Harikar,DoH,Harikar,Harikar DoH,JCCC,TUTAPONA UNICEF CARE JIYAN FOUNDATION PWJ,,,,,,
Bajet Kandala,37.054789,42.445256,Duhok,Sumail,Camp,Yes,No,IQ0803-0001,20-Aug,Yes,Govt.-MoI/JCCC,Yes,Yes,ACTED,6,6,Yes,10,2,,,Yes,Face to face at complaints desk Face to face with CCCM staff / Community Mobilisers,Camp Management Committee Women committee Youth committee Distribution Committee Maintenance Committee WASH Committee Health Committee Education Committee,Yes,Community centre or space for community self-run activities Community centre run by humanitarian organizations (currently open) Child Friendly Space (currently open),Excel based,Camp Management Team NGO Printed material (banners/posters/pamphlets) Facebook Word of Mouth Internet (news websites) Mobile Phones Camp Committees,NA,0,0,UNHCR Type ofTents,,,,,,1522,1522,0,0,0,,,,,,,,,,,,,,,,,,,,,,,,Yes,5,1900,9706,309,311,342,311,775,788,701,755,1367,1495,1003,1066,203,280,No,No,Electricity grid,92,Dug Well (HH Well),Yes,0,No,Yes,Communal garbage bin,Communal latrines,914,11,Communal showers,893,11,About half (~50%),About half (~50%),All (100%),Numerous trauma-related injuries,Yes,6,Decreased opening hours,Yes,Yes,Yes,Yes,Yes,No,Between 2- 5 km,Yes,Yes,Yes,Yes,NA,Once per month,Once per month,No,,,Prefer not to say,NA,NA,Group counselling (with small amount of people),NA,0,20,NA,Yes,,Yes,,3000,Yes,NA,0,Yes,,Reduced availability of items,"Harikar, Dolsa, VOP",,,Government/Local Authorities,,KURDS,KURDS,Government/ Local Authorities,ACTED WVI MoDM,HARIKAR PUI FCO UNICEF,,PUI Harikar,,,Harikar,
Mamilian,36.68664,43.7965,Ninewa,Aqra,Camp,Yes,No,IQ1501-0002,20-Aug,Yes,Govt.-MoI/JCCC,Yes,Yes,ACTED,6,6,Yes,4,2,,,No,,No Committees,Yes,No,Excel based,Camp Management Team Community leaders Loudspeakers,2800,0,0,MoMD Type of Tents,200,200,NA,NA,200,,,,,,,,,,,,,,,,,,,,,,,,,,,,,No,0,171,881,37,36,48,46,87,72,60,55,82,129,92,97,14,26,No,No,Electricity grid,300,Network (private access),Yes,0,No,Yes,Municipal collection,Private latrines,171,5,Communal showers Private showers,171,5,All (100%),None,All (100%),No other issue reported,Yes,6,Opening hours and services have not changed,No,Yes,Yes,No,Yes,No,More than 5 km,Yes,Yes,Yes,Yes,0-25%,Once per month,Once per month,No,,,No,No,No,No PSS services,There were no services in this camp before COVID-19,16,14,Usually not functioning for IDPs,Yes,,Yes,,NA,No,No,0,Yes,,No changes,,,,,,PAH,PAH,PAH,,UNICEF IOM PWJ,,,,,,
Hasansham U3,36.32304,43.5395,Ninewa,Al-Hamdaniya,Camp,Yes,No,IQ1503-0030,20-Aug,Yes,Govt.-MoI/JCCC,Yes,No,,5,5,Yes,5,11,0,0,No,,Camp Management Committee WASH Committee Health Committee,Yes,Community centre or space for community self-run activities Community centre run by humanitarian organizations (currently open) Child Friendly Space (currently closed due to COVID-19),ASSIST,Camp Management Team Camp Committees,1936,0,0,"UNHCR Type ofTents Constructed Structure (ex. Housing units constructed by blocks, fully upgraded)",,,,,,1440,1495,1200,NA,251,,,,,,,,,,,,,,,,,,,,,,,,Yes,3,1194,5461,111,99,318,297,658,697,504,481,447,631,390,678,44,106,No,No,Centralized generators,70,Water Trucking,Yes,0,No,Yes,Communal garbage bin,Communal latrines,475,11,Communal showers,475,11,About a quarter (~ 25%),About a quarter (~ 25%),About three quarters (~75%),"Numerous cases of diarrhoea Skin diseases (scabies, contagious rashes, etc.) Numerous cases of fever Numerous cases of respiratory diseases Numerous cases of pregnancy related diseases",Yes,5,Opening hours and services have not changed,Yes,Yes,No,Yes,Yes,No,More than 5 km,NA,NA,NA,NA,0-25%,No WFP distribution in this camp,Once per month,No,,,No,No,Yes,PSS through case management,"The same services are functioning as before COVID-19, and all services are being delivered in-person",500,5,Currently closed due to COVID-19 but usually functioning for IDPs,Yes,,No,Within 2 km,1730,No,Yes,600,Yes,,No changes,SWEDO,Al-Masala,TDH-Italy,TDH-Italy,UNHCR,PAH,PAH,PAH,UNHCR,DoH BCF,,IOM,UNICEF,MoDM,,BCF
Laylan IDP,35.3282247,44.5305443,Kirkuk,Kirkuk,Camp,Yes,No,IQ1302-0001,20-Aug,Yes,Blumont,Yes,No,,5,0,Yes,49,9,,,Yes,Hotline phone number Complaints boxes Face to face with CCCM staff / Community Mobilisers Through community representatives (e.g. Sector/Block leaders),Women committee Youth committee Children committee - Conflict committee,Yes,Functional sports facilities (e.g. football pitch) Community centre run by humanitarian organizations (currently closed due to COVID-19) Child Friendly Space (currently closed due to COVID-19),Excel based,Camp Management Team Word of Mouth Community leaders Loudspeakers Camp Committees,2005,0,0,UNHCR Type ofTents,,,,,,1798,1798,289,1509,72,,,,,,,,,,,,,,,,,,,,,,,,No,5,1329,7143,343,316,576,509,653,679,770,692,484,890,366,653,63,149,Yes,No,Electricity grid,90,Dug Well (HH Well),Yes,0,No,Yes,Communal garbage bin,Communal latrines,520,14,Communal showers,328,22,All (100%),About half (~50%),All (100%),"Skin diseases (scabies, contagious rashes, etc.)",Yes,7,Opening hours and services have not changed,Yes,Yes,Yes,Yes,Yes,No,Between 2- 5 km,NA,NA,NA,NA,76%-100%,Once per month,Once per month,No,,,No,No,No,Individual counselling Group counselling (with small amount of people) PSS through case management,"The same services are functioning as before COVID-19, but some or all services are now being delivered remotely (e.g. by phone)",116,30,"Yes, currently open and operational for IDPs",Yes,,Yes,,2505,No,No,0,Yes,,No changes,HAI,IAA IRC,FUAD,DoE,Blumont,Mercy Corps,Mercy Corps,Mercy Corps,Blumont,WVI JIYAN FOUNDATION PUI,,Zhian Org,,WFP,,WEO/TearFund
As Salamyiah 2,36.1537365,43.3208858,Ninewa,Al-Hamdaniya,Camp,Yes,No,IQ1503-0027-002,20-Aug,Yes,ACTED,Yes,No,,7,0,Yes,26,11,,,Yes,Face to face at complaints desk Hotline phone number Complaints boxes Face to face with CCCM staff / Community Mobilisers Through community representatives (e.g. Sector/Block leaders),Camp Management Committee Women committee Youth committee Distribution Committee Maintenance Committee WASH Committee Health Committee Education Committee,Yes,Functional sports facilities (e.g. football pitch) Community centre or space for community self-run activities Community centre run by humanitarian organizations (currently closed due to COVID-19) Child Friendly Space (currently closed due to COVID-19),ASSIST,Camp Management Team Facebook Community leaders Camp Committees,5687,35,0,MoMD Type of Tents UNHCR Type ofTents,692,692,692,0,30,4748,2665,1420,1420,1420,,,,,,,,,,,,,,,,,,,,,,,,No,12,2583,12767,557,569,709,741,1406,1375,1035,1019,1092,1389,975,1493,140,267,Yes,No,Centralized generators,70,water trucking and network(communal access),Yes,0,No,Yes,Communal garbage bin,Communal latrines,250,51,Communal showers,250,51,All (100%),All (100%),About three quarters (~75%),"Skin diseases (scabies, contagious rashes, etc.)",Yes,7,Opening hours and services have not changed,Yes,Yes,Yes,Yes,Yes,Yes,,Yes,No,Yes,Yes,0-25%,Once per month,Once per month,Yes,Needing to show ID documents to civilian authorities or security actors to exit/enter the camp Time restrictions on when to leave and return,Restrictions have increased since COVID-19 and are imposed solely for health reasons,No,No,Yes,Psychological First Aid Structured PSS Individual counselling PSS through case management,"The same services are functioning as before COVID-19, but some or all services are now being delivered remotely (e.g. by phone)",700,15,"Yes, currently open and operational for IDPs",Yes,,Yes,,4000,No,Yes,300,Yes,,No changes,Intersos,"WRO UIMS, INTERSOS",IRC TDH-Italy,Intersos,UNHCR,Pekawa ACTED,Pekawa ACTED,Pekawa ACTED,UNHCR,PUI DARY HI UIMS,,PUI,DARY,WFP MoDM,,ACTED
Qayyarah-Jad'ah 1,35.76045,43.268035,Ninewa,Al-Mosul,Camp,Yes,No,IQ1505-0010-001,20-Aug,Yes,RNVDO,Yes,No,,6,0,Yes,8,0,,,Yes,Hotline phone number Complaints boxes Through community representatives (e.g. Sector/Block leaders),Women committee Youth committee Maintenance Committee WASH Committee Sector representative committee,Yes,Community centre or space for community self-run activities Child Friendly Space (currently open),Excel based,Camp Management Team NGO Camp Committees,2000,0,0,MoMD Type of Tents,1419,1285,1285,0,0,,,,,,,,,,,,,,,,,,,,,,,,,,,,,No,25,1156,4452,25,30,30,32,222,210,220,254,951,938,673,742,79,46,Yes,No,Electricity grid,60,Water Trucking,Yes,0,No,Yes,Communal garbage bin,Public latrines,260,17,Public showers,260,17,All (100%),About three quarters (~75%),All (100%),No other issue reported,Yes,7,Opening hours and services have not changed,Yes,Yes,Yes,Yes,Yes,No,Between 2- 5 km,Yes,Yes,Yes,Yes,0-25%,Once per month,Once per month,No,,,No,No,Yes,Structured PSS Individual counselling PSS through case management,"The same services are functioning as before COVID-19, and all services are being delivered in-person",100,3,Usually not functioning for IDPs,Yes,,Yes,,400,No,Yes,NA,Yes,,No changes,"IMC TDH-Italy WRO, NP, INTERSOS","TDH-Italy WRO, INTERSOS",TDH-Italy WRO,,,Pekawa UNICEF,Pekawa UNICEF,Pekawa UNICEF,,IMC DAMA ZHIAN ORG HI DARY,,IMC,DAMA,WFP MoDM,RNVDO,
Rwanga Community,37.0603,42.618683,Duhok,Sumail,Camp,Yes,No,IQ0803-0004,20-Aug,Yes,Govt.-MoI/JCCC,Yes,Yes,ACTED,6,5,Yes,4,3,,,Yes,Through community representatives (e.g. Sector/Block leaders),No Committees,Yes,Functional sports facilities (e.g. football pitch) Community centre run by humanitarian organizations (currently closed due to COVID-19) Child Friendly Space (currently closed due to COVID-19),Excel based,Community leaders,NA,35,10,Caravans,,,,,,,,,,,,,,,,,,,,,3000,3000,0,0,,,,,,,,,,No,0,2484,13185,228,317,389,489,1014,1059,923,973,1924,2240,1491,1515,273,350,No,Yes,Electricity grid Centralized generators,67,Dug Well (HH Well),Yes,0,No,Yes,Municipal collection,Private latrines,3000,4,Private showers,3000,4,About three quarters (~75%),Don’t know / Unsure,About three quarters (~75%),No other issue reported,Yes,5,Opening hours and services have not changed,Yes,Yes,No,Yes,Yes,No,Between 2- 5 km,Yes,Yes,Yes,Yes,0-25%,Once per month,Once per month,No,,,No,No,No,Psychological First Aid Individual counselling,NA,0,35,NA,Yes,,Yes,,3069,No,No,0,Yes,,No changes,"Hawar, IOM, Lotus Flower, Emma, Elise care, Hrikar, VOP",,,MoE,,Government/Local Authorities,KURDS,KURDS,,"HEEVIE ELISECARE, MEDAIR UNICEF",,,WVI MoDM,WFP,,
Latifiya 2,32.9851222,44.4756722,Baghdad,Al-Mahmoudiya,Camp,Yes,No,IQ0706-0003,20-Aug,Yes,Govt.-Mayoralty Office,Yes,Yes,BLUMONT,4,4,Yes,3,1,,,Yes,Hotline phone number Complaints boxes,Camp Management Committee Women committee Youth committee Maintenance Committee WASH Committee Health Committee Education Committee Safety Committee,Yes,Recreational workshops (caravans) inside the camp and the space constructed by the organization,Paper based,Camp Management Team NGO Community leaders Camp Committees,NA,0,0,MoMD Type of Tents Makeshift or Improvised Shelter,4,4,4,4,4,,,,,,,,,,,,,,,,,,,,,,,,,,,8,8,No,1,12,56,1,1,6,6,1,5,4,7,9,10,3,2,0,1,No,No,Electricity grid Generators privately owned,40,Network (communal access),Yes,10,No,No,Private collection,Communal latrines,5,11,Communal showers,5,11,All (100%),About three quarters (~75%),Less than a quarter,"Skin diseases (scabies, contagious rashes, etc.) Other(s) – specify",No,6,Decreased opening hours,NA,NA,NA,NA,Yes,No,More than 5 km,Yes,Yes,Yes,Yes,0-25%,No WFP distribution in this camp,Once per month,No,,,No,No,No,Structured PSS PSS through case management,There were no services in this camp before COVID-19,0,3,"Yes, currently open and operational for IDPs",No,Within 2 km,No,Within 2 km,5,NA,No,0,No,Within 2 km,Reduced access to a previously accessible market,"UNHCR, LCN, Al-Murtaqa Foundation",,,,,,,,UNHCR,,,PUI,,,,
Latifiya 1,32.91360323,44.55127716,Baghdad,Al-Mahmoudiya,Camp,Yes,No,IQ0706-0004,20-Aug,Yes,Govt.-Mayoralty Office,Yes,Yes,BLUMONT,4,4,Yes,3,1,,,Yes,Hotline phone number Complaints boxes,Camp Management Committee Women committee Youth committee Maintenance Committee WASH Committee Health Committee Education Committee Safety & Security Committee,Yes,Workshops caravans for recreational  & Shaded area,Paper based,Camp Management Team NGO Community leaders Camp Committees,NA,0,0,MoMD Type of Tents Makeshift or Improvised Shelter,11,11,11,11,11,,,,,,,,,,,,,,,,,,,,,,,,,,,17,17,No,2,28,119,2,1,7,3,15,13,25,9,12,12,4,14,0,2,No,No,Electricity grid Generators privately owned,40,RO Unit,Yes,10,No,No,Private collection,Communal latrines,10,12,Communal showers,10,12,All (100%),About three quarters (~75%),Less than a quarter,"Skin diseases (scabies, contagious rashes, etc.) Other(s) – specify",No,6,Increased opening hours,NA,NA,NA,NA,Yes,No,More than 5 km,Yes,Yes,Yes,Yes,0-25%,No WFP distribution in this camp,Once per month,No,,,No,No,No,Structured PSS PSS through case management,There were no services in this camp before COVID-19,0,3,"Yes, currently open and operational for IDPs",No,Within 2 km,No,Within 2 km,30,NA,No,0,No,Within 2 km,Reduced access to a previously accessible market,"UNHCR, LCN, Al-Murtaqa Foundation",Umel Yateem,,,,,,,UNHCR,PUI,,PUI,,,,
