Camp_Name,coordinates_latitude,coordinates_longitude,governorate,district,site_typology,camp_open,site_reduction_planned,site_name,month,camp_mngt,camp_mngt_agency,camp_mngmt_office,camp_mngt_support,camp_mngt_support_agency,camp_mngt_presence,camp_mngt_support_presence,camp_mngt_dedicated_office,camp_mngmt_male_staff,camp_mngmt_female_staff,camp_mngmt_suppot_male_staff,camp_mngmt_suppot_female_staff,camp_mgmt_mechanism_for_compain_request_notIIC,camp_mgmt_mechanism_for_compain_request_process_ifnot,camp_committee,camp_sector_block_leader,camp_recreational_facilities,population_tracking,camp_distribution_announcement,plots/maxm_hosting_capacity,plots/no_of_families_incamp_waiting_shelter,plots/no_of_families_outside_camp_waiting_shelters,shelter_types,shelter_types/modm_tents_installed,shelter_types/modm_tents_occupied,shelter_types/modm_tents_1_winter,shelter_types/modm_tents_2_winter,shelter_types/modm_tents_replacement,shelter_types/unhcr_tents_intalled,shelter_types/unhcr_tents_occupied,shelter_types/unhcr_tents_1_winter,shelter_types/unhcr_tents_2_winter,shelter_types/unhcr_tents_replacement,shelter_types/afad_tents_installed,shelter_types/afad_tents_occupied,shelter_types/afad_tents_1_winter,shelter_types/afad_tents_2_winter,shelter_types/afad_tents_replacement,shelter_types/other_tents_installed,shelter_types/other_tents_occupied,shelter_types/other_tents_1_winter,shelter_types/other_tents_2_winter,shelter_types/other_tents_replacement,shelter_types/caravans_installed,shelter_types/caravans_occupied,shelter_types/caravans_repairs,shelter_types/caravans_replacement,shelter_types/RHU_installed,shelter_types/RHU_occupied,shelter_types/RHU_repairs,shelter_types/RHU_replacement,shelter_types/semi_permanent_structure,shelter_types/semi_permanent_structure_occupied,shelter_types/semi_permanent_structure_repairs,shelter_types/improvised_makeshift_shelter,shelter_types/improvised_makeshift_shelter_occupied,shelter_types/Flood Risks,shelter_types/no_of_fireincidents,total_hh/total_families,ind_ages/total_population,ind_ages/ind_age_groups/males_0_2,ind_ages/ind_age_groups/females_0_2,ind_ages/ind_age_groups/males_3_5,ind_ages/ind_age_groups/females_3_5,ind_ages/ind_age_groups/males_6_11,ind_ages/ind_age_groups/females_6_11,ind_ages/ind_age_groups/males_12_17,ind_ages/ind_age_groups/females_12_17,ind_ages/ind_age_groups/males_18_30,ind_ages/ind_age_groups/females_18_30,ind_ages/ind_age_groups/males_31_59,ind_ages/ind_age_groups/females_31_59,ind_ages/ind_age_groups/males_60_over,ind_ages/ind_age_groups/females_60_over,nfi_items/replacement,nfi_items/kerosene cooking/ fuel distribution on the camp ?,nfi_items/kerosene cooking/ source_electiricity,wash/water_quantity,wash/water_source,wash/primarydrinkingwater_color_odour_smellacceptable,wash/avg_days_familiesspentwithoutwaterinlast30days,wash/open_defecation,wash/soap_available_for_washing_hands,wash/primary_waste_disposal,wash/type_of_functionallatrines,wash/no._of_functionallatrines,wash/person/latrines,wash/type_of_functionalshower,wash/no._of_functionalshower,wash/persons/shower,wash/lightning_around_latrines,wash/proportion_latrines_male_female,wash/proportion_latrines_functional_locks,health/Illness_in_site,health/health_phc,health/health_open_days,health/health_open_days_after_COVD19,health/health_phc_emergency_services,health/health_phc_child_health_services,health/health_phc_reproductive_Health_services,health/ambulance_service,health/health_shc,health/health_shc_inside_camp,health/health_shc_distance_from_camp,health/health_shc_emergency_services,health/health_shc_surgical_services,health/health_shc_child_health_services,health/health_shc_reproductive_health_services,health/children_under_5_vaccinatedfor_poliomeasles,food_security/food_access_WFP,food_security/food_access_MoDM,protection/movement_restrictions,protection/movement_restrictions_type,protection/movement_restrictions_changed_since_COVID19,protection/tension_IDPs_hostcomm,protection/anysecurityincidentsinlast30days,protection/adequatefacilities_services,protection/psychosocial_support,protection/psychosocial_support_changed_since_COVID19,protection/families_missing_documentation,protection/distance_court_civiloffice_kms,protection/courts_civil_office_opertional_to_IDPs,education/functioning_primary_school,education/functioning_primary_school_distance,education/functioning_secondary_school,education/functioning_secondary_school_distance,education/schoolagedchildren_access_before_COVID19,education/disinfection_schoolopening,education/informal_education_activities_available,education/informal_education_before_COVID19,livelihoods/market_available,livelihoods/nearest_market_kms,livelihoods/market access_before_COVID19,PROTECTION,GBV,CHILD_PROTECTION,EDUCATION,SHELTER,WATER,SANITATION,WASTE_MANAGEMENT,NFI,PHC,SHC,MHPSS,NUTRITION,FOOD,SOCIAL_COHESION,LIVELIHOOD
Arbat IDP,35.4344959,45.590574,Al-Sulaymaniyah,Al-Sulaymaniyah,Camp,Yes,Yes,IQ0510-0001,20-Aug,Yes,Govt.-MoI/JCCC,Yes,No,,5,1,Yes,1,1,0,1,Yes,Complaints boxes,No Committees,No,Community centre or space for community self-run activities,ASSIST,Camp Management Team NGO Community leaders,416,0,0,RHU (Refugee Housing Unit),,,,,,,,,,,,,,,,,,,,,,,,,400,352,0,352,,,,,,No,0,301,1395,75,65,82,62,133,150,109,120,158,157,110,138,13,23,No,No,Electricity grid,82,Dug Well (HH Well),Yes,0,No,Yes,Municipal collection,Private latrines,416,3,Private showers,416,3,About three quarters (~75%),All (100%),All (100%),No other issue reported,Yes,6,Reduced services,Yes,Yes,Yes,No,Yes,No,More than 5 km,NA,NA,NA,NA,0-25%,Once per month,Once per month,Yes,as normal movement,Restrictions have increased since COVID-19 and are imposed solely for health reasons,No,No,No,Individual counselling PSS through case management,"Some services are functioning as before COVID-19, but some are stopped",42,25,"Yes, currently open and operational for IDPs",Yes,,Yes,,NA,Yes,No,NA,Yes,,No changes,HAI,DoLSA SWEDO-PDO Mobile team,DOLSA,UNICEF,JCCC,Mercy Corps,Mercy Corps,Uraos CO.,UNHCR,UNICEF ZHIAN ORG,,Jiyan Foundation,,WFP,,
Ashti IDP,35.41762,45.60593,Al-Sulaymaniyah,Al-Sulaymaniyah,Camp,Yes,No,IQ0510-0002,20-Aug,Yes,Govt.-MoI/JCCC,Yes,No,,5,2,Yes,2,1,4,0,Yes,Face to face at complaints desk Complaints boxes,Camp Management Committee,Yes,Community centre run by humanitarian organizations (currently closed due to COVID-19) Child Friendly Space (currently closed due to COVID-19),ASSIST,Camp Management Team Facebook Community leaders,2630,0,0,MoMD Type of Tents UNHCR Type ofTents,2074,2074,1800,274,274,412,412,27,385,385,,,,,,,,,,,,,,,,,,,,,,,,No,15,1845,9355,219,205,526,517,954,934,821,796,1282,1197,1044,653,165,42,Yes,No,Electricity grid,57,Network (private access),Yes,5,Yes,Yes,Municipal collection,Private latrines,2630,4,Private showers,2630,4,All (100%),None,All (100%),No other issue reported,Yes,7,Opening hours and services have not changed,Yes,Yes,Yes,Yes,Yes,No,More than 5 km,NA,NA,NA,NA,76%-100%,Once per month,Once per month,No,,,No,No,No,Structured PSS,"The same services are functioning as before COVID-19, but some or all services are now being delivered remotely (e.g. by phone)",300,30,Usually not functioning for IDPs,Yes,,Yes,,NA,No,No,0,Yes,,No changes,HAI,DoLSA SWEDO-PDO Mobile team,DOLSA,SSORD,UNHCR,Arche Nova,Arche Nova,Arche Nova,UNHCR,ZHIAN ORG UNICEF HEEVIE,,Zhian Org,,WFP,,PLC
Darkar,37.198176,42.832349,Duhok,Zakho,Camp,Yes,No,IQ0804-0290,20-Aug,Yes,Govt.-MoI/JCCC,Yes,Yes,ACTED,5,2,Yes,5,1,1,2,Yes,Hotline phone number Face to face with CCCM staff / Community Mobilisers,Camp Management Committee Distribution Committee Maintenance Committee,No,Child Friendly Space (currently closed due to COVID-19),Excel based,Camp Management Team Camp Committees,801,235,10,Caravans,,,,,,,,,,,,,,,,,,,,,801,800,200,2,,,,,,,,,,No,2,692,3712,134,118,142,171,305,310,294,268,515,537,378,383,71,86,No,No,Electricity grid Generators privately owned,66,Network (private access),Yes,0,No,Yes,Communal garbage bin,Private latrines,800,5,Private showers,800,5,All (100%),None,All (100%),"Numerous cases of diarrhoea Skin diseases (scabies, contagious rashes, etc.)",Yes,6,Decreased opening hours,No,No,Yes,Yes,Yes,No,Between 2- 5 km,Yes,Yes,Yes,Yes,0-25%,Once per month,Once per month,No,,,No,No,No,No PSS services,There were no services in this camp before COVID-19,300,100,"Yes, currently open and operational for IDPs",Yes,,Yes,,1120,No,No,0,Yes,,Reduced access to a previously accessible market,"Harikar, Emma, Harikar, VOP",,,,,KURDS,BRHA,BRHA,,ELISCARE HARIKAR UNICEF,,,,,,
Hamam Al Alil 2,36.15132,43.2427,Ninewa,Al-Mosul,Camp,Yes,Yes,IQ1505-0015,20-Aug,Yes,NRC,Yes,No,,7,0,Yes,9,4,,,Yes,Face to face at complaints desk Hotline phone number Complaints boxes Face to face with CCCM staff / Community Mobilisers Through community representatives (e.g. Sector/Block leaders),Camp Management Committee Women committee Youth committee,Yes,Functional sports facilities (e.g. football pitch) Community centre or space for community self-run activities Community centre run by humanitarian organizations (currently closed due to COVID-19) Child Friendly Space (currently closed due to COVID-19),ASSIST,Camp Management Team NGO Community leaders Camp Committees,4656,0,0,UNHCR Type ofTents,,,,,,2334,2322,743,0,1500,,,,,,,,,,,,,,,,,,,,,,,,No,20,1848,8622,275,313,487,537,1104,1070,767,729,517,856,585,1171,41,170,Yes,No,Generators privately owned,65,Network (communal access),Yes,0,Yes,Yes,Private collection,Communal latrines,582,15,Communal showers,582,15,About half (~50%),About half (~50%),About half (~50%),"Skin diseases (scabies, contagious rashes, etc.) Numerous cases of fever Numerous cases of respiratory diseases",Yes,7,Opening hours and services have not changed,Yes,Yes,No,Yes,Yes,No,Between 2- 5 km,NA,NA,NA,NA,NA,Once per month,Once per month,No,,,No,No,Yes,Psychological First Aid Individual counselling Learning spaces and recreational PSS activities PSS through case management,"The same services are functioning as before COVID-19, and all services are being delivered in-person",1100,5,"Yes, currently open and operational for IDPs",Yes,,No,Between 2-5 km,998,Yes,Yes,2927,Yes,,No changes,IMC Intersos TDH-Italy,IMC Intersos,TDH-Italy,NRC,UNHCR NRC,Pekawa,Pekawa,Pekawa,UNHCR NRC,IMC DARY HI,,IMC ACF,DARY,WFP,,Mercy Corps
Sheikhan,36.677814,43.343325,Ninewa,Al-Shikhan,Camp,Yes,No,IQ1506-0002,20-Aug,Yes,Govt.-MoI/JCCC,Yes,Yes,ACTED,6,2,Yes,4,3,1,1,Yes,Face to face at complaints desk Through community representatives (e.g. Sector/Block leaders),Camp Management Committee,No,Functional sports facilities (e.g. football pitch) Community centre run by humanitarian organizations (currently open) Child Friendly Space (currently open),ASSIST,Camp Management Team Mobile Phones,1004,306,0,MoMD Type of Tents,1004,904,904,904,1004,,,,,,,,,,,,,,,,,,,,,,,,,,,,,No,3,739,3670,97,117,127,135,289,297,289,253,534,541,415,404,69,103,No,No,Electricity grid Centralized generators,50,Network (private access),Yes,0,No,Yes,Municipal collection,Private latrines,1004,4,Private showers,1004,4,About three quarters (~75%),None,About three quarters (~75%),Numerous cases of respiratory diseases,Yes,6,Opening hours and services have not changed,Yes,Yes,,Yes,Yes,No,Between 2- 5 km,Yes,Yes,Yes,Yes,0-25%,Once per month,Once per month,No,,,No,No,No,Psychological First Aid,"Some services are functioning as before COVID-19, but some are stopped",51,5,Yes,Yes,,Yes,,1120,,No,0,Yes,,,IOM UNICEF VOP,,,DoE,,LWF,LWF,LWF,,HARIKAR UNICEF IOM PWJ,,,,UNHCR,,
Kabarto 1,36.7863,42.8549,Duhok,Sumail,Camp,Yes,No,IQ0803-0002,20-Aug,Yes,Govt.-MoI/JCCC,Yes,Yes,ACTED,5,0,Yes,3,5,,,Yes,Complaints boxes,Camp Management Committee Women committee Distribution Committee Maintenance Committee WASH Committee Health Committee Education Committee,Yes,Child Friendly Space (currently closed due to COVID-19),Excel based,Camp Management Team,3000,48,23,MoMD Type of Tents,3000,3000,2100,900,900,,,,,,,,,,,,,,,,,,,,,,,,,,,,,No,7,2543,13237,412,472,562,550,1166,1129,973,911,1727,1931,1412,1434,204,354,No,Yes,Electricity grid Generators privately owned,30,Network (private access),Yes,0,No,Yes,Communal garbage bin,Private latrines,3000,4,Private showers,3000,4,All (100%),None,All (100%),Other(s) – specify,Yes,7,Opening hours and services have not changed,Yes,Yes,Yes,Yes,Yes,No,Between 2- 5 km,Yes,No,Yes,Yes,NA,Once per month,Once per month,No,,,No,No,No,Psychological First Aid,All services that were delivered before COVID-19 are now stopped,90,25,Currently closed due to COVID-19 but usually functioning for IDPs,Yes,,Yes,,3640,No,No,0,No,Within 2 km,No changes,"DoLSA Harikar, SoSD, SOS, Yahad,  War Child UK, Dolsa , Harikar, IRCS, Jinda, NRC, SOSD",War Child,DOLSA,War Child DOLSA,SWEDO UNHCR BCF,KURDS,DAMA,KURDS,SWEDO BCF,IMC DAMA UNICEF BW,,IOM VoP,,MoDM,BW,
Harshm,36.256285,43.994913,Erbil,Erbil,Camp,Yes,No,IQ1102-0002,20-Aug,Yes,Govt.-MoI/JCCC,Yes,Yes,BCF,5,0,Yes,5,5,,,Yes,Face to face at complaints desk Hotline phone number Complaints boxes Face to face with CCCM staff / Community Mobilisers,Camp Management Committee,Yes,Functional sports facilities (e.g. football pitch),ASSIST,Camp Management Team,301,38,63,Caravans,,,,,,,,,,,,,,,,,,,,,301,NA,100,60,,,,,,,,,,No,1,286,1458,43,44,60,63,152,140,138,147,148,155,166,166,8,28,Yes,No,Electricity grid Generators privately owned Solar,150,Network (private access),Yes,0,No,Yes,Communal garbage bin,Private latrines,236,6,Private showers,237,6,Less than a quarter,None,None,"Skin diseases (scabies, contagious rashes, etc.)",Yes,2,Increased opening hours,Yes,Yes,Yes,No,Yes,No,NA,NA,NA,NA,NA,26%-50%,More than once per month,More than once per month,Yes,Needing to obtain security clearance/coupons,Restrictions have decreased since COVID-19,No,No,No,Individual counselling No PSS services,There were no services in this camp before COVID-19,16,4,"Yes, currently open and operational for IDPs",Yes,,Yes,,NA,Yes,No,0,Yes,,No changes,SWEDO,Al-Masala,TDH-Italy,,UNHCR BCF,Mercy corps,Mercy corps,Mercy Corps,UNHCR,DoH BCF,,,,MoDM,,
Al-Nabi Younis,33.36286,44.66264,Baghdad,Al-Risafa,Camp,Yes,No,IQ0707-0001,20-Aug,Yes,Govt.-Baghdad Govt.,Yes,Yes,IOM,7,4,Yes,3,0,1,1,Yes,Hotline phone number Face to face with CCCM staff / Community Mobilisers Through community representatives (e.g. Sector/Block leaders),Camp Management Committee Women committee Youth committee Distribution Committee Maintenance Committee,Yes,Functional sports facilities (e.g. football pitch),Paper based,Camp Management Team NGO Loudspeakers,110,0,0,Caravans,,,,,,,,,,,,,,,,,,,,,110,99,0,0,,,,,,,,,,No,0,61,264,5,6,9,10,7,9,35,57,32,35,23,30,3,3,No,No,Electricity grid,60,Purchased from Shop,No,0,Yes,Yes,Municipal collection,Private latrines,110,2,Private showers,110,2,About three quarters (~75%),All (100%),About three quarters (~75%),No other issue reported,Yes,5,Decreased opening hours,No,No,No,No,Yes,No,Between 2- 5 km,Yes,Yes,No,No,0-25%,No WFP distribution in this camp,Once per month,No,,,No,No,No,No PSS services,There were no services in this camp before COVID-19,0,20,"Yes, currently open and operational for IDPs",Yes,,Yes,,50,No,Yes,0,Yes,,Increased prices,"UNHCR, LCN, Al-Murtaqa Foundation",,,MoE,IOM,Saba' Sanabul,Saba' Sanabul,Saba' Sanabul,IOM,MoH,,,,MoDM,,
Al-Kawthar Camp,32.52555,44.10444,Kerbela,Al-Hindiya,Camp,Yes,No,IQ1203-0001,20-Aug,Yes,Govt.-MoDM,Yes,No,,2,0,Yes,3,1,,,Yes,Hotline phone number Face to face with CCCM staff / Community Mobilisers,Women committee Youth committee,Yes,Community centre run by humanitarian organizations (currently open) Child Friendly Space (currently open),Paper based,Community leaders Mobile Phones Camp Committees,NA,0,0,Caravans,,,,,,,,,,,,,,,,,,,,,1114,85,85,0,,,,,,,,,,No,0,85,519,11,18,20,22,65,57,41,48,47,44,64,70,4,8,No,No,Electricity grid,20,Water Trucking,Yes,0,No,Yes,Municipal collection,Private latrines,85,6,Private showers,85,6,None,None,None,No other issue reported,No,6,NA,NA,NA,NA,NA,Yes,No,More than 5 km,NA,NA,NA,NA,NA,No WFP distribution in this camp,Once per month,No,,,No,No,No,Psychological First Aid Structured PSS Individual counselling Learning spaces and recreational PSS activities,"The same services are functioning as before COVID-19, but some or all services are now being delivered remotely (e.g. by phone)",0,15,NA,Yes,,Yes,,211,NA,No,0,No,Within 2 km,No changes,DRC LCN UNHCR,DRC LCN UNHCR,DRC LCN UNHCR,Government/Local Authorities,,Government/Local Authorities,Government / Local Authorities,Government/ Local Authorities,,,,,,,,
Zayona,33.317933,44.445211,Baghdad,Al-Risafa,Camp,Yes,No,IQ0707-0043,20-Aug,Yes,Christian Endowment,Yes,Yes,IOM,7,4,Yes,1,2,1,2,Yes,Hotline phone number Face to face with CCCM staff / Community Mobilisers Through community representatives (e.g. Sector/Block leaders),Camp Management Committee Women committee Youth committee Distribution Committee Maintenance Committee,Yes,Football field but still under construction,Excel based,Camp Management Team NGO Loudspeakers Camp Committees,148,0,0,Caravans,,,,,,,,,,,,,,,,,,,,,148,116,0,0,,,,,,,,,,No,0,110,363,5,6,10,8,52,54,48,37,32,28,26,23,12,22,No,No,Electricity grid,30,Network (private access),Yes,0,No,Yes,Municipal collection,Private latrines,148,2,Private showers,148,2,All (100%),All (100%),All (100%),No other issue reported,Yes,5,Opening hours and services have not changed,No,No,No,No,Yes,No,Between 2- 5 km,Yes,Yes,Yes,Yes,0-25%,No WFP distribution in this camp,Once per month,No,,,No,No,No,No PSS services,There were no services in this camp before COVID-19,0,3,"Yes, currently open and operational for IDPs",No,Within 2 km,No,Within 2 km,100,No,Yes,0,Yes,,Increased prices,"UNHCR, LCN, Al-Murtaqa Foundation",,,,IOM,Saba' Sanabul,Saba' Sanabul,Saba' Sanabul Government/ Local Authorities,IOM,MoH,,IOM,MoDM,MoDM,IOM,
Mamrashan,36.667236,43.433069,Ninewa,Al-Shikhan,Camp,Yes,No,IQ1506-0003,20-Aug,Yes,Govt.-MoI/JCCC,Yes,Yes,ACTED,6,6,Yes,4,2,,,Yes,Hotline phone number Complaints boxes Face to face with CCCM staff / Community Mobilisers Through community representatives (e.g. Sector/Block leaders),Camp Management Committee Distribution Committee Maintenance Committee,Yes,Functional sports facilities (e.g. football pitch) Community centre or space for community self-run activities Community centre run by humanitarian organizations (currently closed due to COVID-19) Child Friendly Space (currently open),Excel based,Camp Management Team Facebook Word of Mouth Camp Committees,NA,4,0,Caravans,,,,,,,,,,,,,,,,,,,,,1838,1734,0,0,,,,,,,,,,No,0,1631,8182,216,218,277,264,654,692,565,602,1170,1352,875,906,169,222,No,No,Electricity grid,60,Network (communal access),Yes,0,No,Yes,Communal garbage bin,Private latrines,1838,4,Private showers,1838,4,All (100%),None,All (100%),Numerous cases of diarrhoea Numerous cases of respiratory diseases Numerous cases of pregnancy related diseases,Yes,7,Decreased opening hours,No,Yes,Yes,Yes,Yes,No,Between 2- 5 km,Yes,Yes,Yes,Yes,NA,Once per month,Once per month,No,,,No,No,No,Psychological First Aid,"The same services are functioning as before COVID-19, but some or all services are now being delivered remotely (e.g. by phone)",40,25,Usually not functioning for IDPs,Yes,,Yes,,2313,Yes,Yes,150,Yes,,Reduced availability of items Reduced access to a previously accessible market,"Harikar VOP Caritas Essen , Jiyan Foundation, HEEVIE",VOP,VOP,MoE,UNHCR JCCC,Care,Care,Care,MODM,UNICEF JIYAN FOUNDATION HEEVIE PWJ,,Heevie,MoDM WFP,MoDM WFP,JCCC,Humanitarian Organization and Shelter
Al-Ahel,33.48413056,44.18941667,Baghdad,Al-Karkh,Camp,Yes,No,IQ0701-0002,20-Aug,Yes,Govt.-Baghdad Govt.,Yes,Yes,IOM,7,5,Yes,2,1,1,1,Yes,Hotline phone number Face to face with CCCM staff / Community Mobilisers Through community representatives (e.g. Sector/Block leaders),Camp Management Committee Women committee Youth committee Distribution Committee Maintenance Committee WASH Committee,No,Child Friendly Space (currently open),Paper based,Camp Management Team NGO Camp Committees,270,0,0,"RHU (Refugee Housing Unit) Constructed Structure (ex. Housing units constructed by blocks, fully upgraded)",,,,,,,,,,,,,,,,,,,,,,,,,110,70,0,20,160,110,0,,,No,0,81,415,12,14,33,23,16,20,47,51,53,58,40,40,3,5,No,No,Electricity grid,60,Network (private access),Yes,0,Yes,Yes,Municipal collection,Public latrines,120,3,Public showers,120,3,About half (~50%),All (100%),All (100%),No other issue reported,Yes,4,Decreased opening hours,No,No,Yes,No,Yes,No,Between 2- 5 km,Yes,Yes,No,No,0-25%,No WFP distribution in this camp,Once per month,No,,,No,No,No,No PSS services,There were no services in this camp before COVID-19,0,6,"Yes, currently open and operational for IDPs",No,Within 2 km,No,Within 2 km,30,Yes,No,0,Yes,,Reduced availability of items Increased prices,"UNHCR, LCN, Al-Murtaqa Foundation",,,,,Sabe' Sanabal,Sabe' Sanabal,Sabe' Sanabal,IOM,MoH,,,MoDm,MoDM,,
Al-Wand 2,34.319722,45.451111,Diyala,Khanaqin,Camp,Yes,No,IQ1004-0004,20-Aug,Yes,Govt.-Mayoralty Office,Yes,Yes,BLUMONT,7,0,Yes,8,9,,,Yes,Complaints boxes Face to face with CCCM staff / Community Mobilisers Through community representatives (e.g. Sector/Block leaders),Camp Management Committee Women committee Youth committee Distribution Committee Maintenance Committee WASH Committee Health Committee Education Committee Electricity and Energy and People with specific needs,Yes,Functional sports facilities (e.g. football pitch) Community centre or space for community self-run activities Child Friendly Space (currently closed due to COVID-19),Excel based,Camp Management Team Printed material (banners/posters/pamphlets) Community leaders Radio Camp Committees,512,0,0,UNHCR Type ofTents,,,,,,218,218,6,212,218,,,,,,,,,,,,,,,,,,,,,,,,No,3,162,677,35,36,29,26,65,52,48,40,93,66,76,80,11,20,Yes,No,Electricity grid Generators privately owned,160,Network (communal access),Yes,0,No,Yes,Private collection,Communal latrines,210,3,Communal showers,157,4,All (100%),About half (~50%),All (100%),Other(s) – specify,Yes,7,Opening hours and services have not changed,Yes,Yes,Yes,Yes,Yes,No,Between 2- 5 km,No,No,Yes,Yes,0-25%,Once per month,Once per month,No,,,No,No,Yes,Psychological First Aid Individual counselling Group counselling (with small amount of people) PSS through case management,"The same services are functioning as before COVID-19, but some or all services are now being delivered remotely (e.g. by phone)",45,12,"Yes, currently open and operational for IDPs",Yes,,No,Within 2 km,310,No,Yes,45,Yes,,No changes,DCVAW LCN SCI UNHCR WEO Khanzaed,DCVAW LCN UNHCR WEO,KSC SCI UNHCR,DOE ,Blumont UNHCR,Arche Nova,Arche Nova,Arche Nova,IOM Blumont UNHCR Mercy Hands,Zhian Org,,LCN WEO SCI,,WFP MoDM,,Blumont
Berseve 1,37.18099,42.85387,Duhok,Zakho,Camp,Yes,No,IQ0804-0001,20-Aug,Yes,Govt.-MoI/JCCC,Yes,Yes,ACTED,5,0,Yes,6,2,,,Yes,Face to face at complaints desk Face to face with CCCM staff / Community Mobilisers Through community representatives (e.g. Sector/Block leaders),No Committees,Yes,Community centre run by humanitarian organizations (currently open),Excel based,Camp Management Team NGO Facebook Community leaders,2000,0,0,Other (specify),,,,,,,,,,,,,,,,,,,,,,,,,,,,,,,,,,No,0,1277,6656,175,183,257,278,551,560,454,460,960,1063,684,690,133,208,No,No,Centralized generators Generators privately owned,75,Dug Well (HH Well),Yes,0,Yes,Yes,Private collection,Communal latrines Private latrines,865,8,No showers,NA,NA,None,All (100%),About half (~50%),No other issue reported,Yes,7,Opening hours and services have not changed,Yes,Yes,Yes,No,Yes,No,More than 5 km,Yes,No,Yes,No,0-25%,Once per month,Once per month,No,,,No,No,No,Psychological First Aid,"Some services are functioning as before COVID-19, but some are stopped",60,15,"Yes, currently open and operational for IDPs",Yes,,Yes,,NA,NA,Yes,120,Yes,,No changes,"Seed DJCC, Green Desert, Harikar, The Swidish Aid Orgnization, VOP",,,UNICEF MOE,JCCC,KURDS,KURDS,Government/ Local Authorities,,UNICEF HEEVIE,,,,,,
Al-Wand 1,34.325296,45.452691,Diyala,Khanaqin,Camp,Yes,No,IQ1004-0003,20-Aug,Yes,Govt.-Mayoralty Office,Yes,Yes,BLUMONT,7,0,Yes,8,9,,,Yes,Complaints boxes Face to face with CCCM staff / Community Mobilisers Through community representatives (e.g. Sector/Block leaders),Camp Management Committee Women committee Youth committee Distribution Committee Maintenance Committee WASH Committee Health Committee Education Committee Electricity and Energy and People with specific needs,Yes,Functional sports facilities (e.g. football pitch) Community centre or space for community self-run activities Community centre run by humanitarian organizations (currently open),Excel based,Camp Management Team Printed material (banners/posters/pamphlets) Community leaders Radio Camp Committees,707,0,0,Caravans,,,,,,,,,,,,,,,,,,,,,707,707,707,0,,,,,,,,,,No,1,494,2174,30,19,145,125,202,204,180,146,298,253,218,255,36,63,Yes,No,Electricity grid Generators privately owned,160,Network (private access),Yes,0,No,Yes,Private collection,Communal latrines,707,3,Communal showers,707,3,All (100%),None,All (100%),Other(s) – specify,Yes,7,Opening hours and services have not changed,Yes,Yes,Yes,Yes,Yes,No,Between 2- 5 km,No,No,Yes,Yes,0-25%,Once per month,Once per month,No,,,No,No,Yes,Psychological First Aid Individual counselling Group counselling (with small amount of people) PSS through case management,"The same services are functioning as before COVID-19, but some or all services are now being delivered remotely (e.g. by phone)",200,12,"Yes, currently open and operational for IDPs",Yes,,Yes,,830,No,No,0,Yes,,No changes,DCVAW LCN SCI UNHCR WEO Khanzaed,DCVAW LCN UNHCR WEO,KSC SCI UNHCR,DOE,Blumont UNHCR,Arche Nova,Arche Nova,Arche Nova,Blumont UNHCR Mercy Hands,Zhian Org,,LCN WEO  SCI,,WFP MoDM,,Blumont
